{
  "schema": "modu.solvable.v1.2",
  "problem_id": "S3_초등_3_008776",
  "problem_type": "unit_choice",
  "inputs": {
    "total_ticks": 0,
    "target_label": "알맞은 단위",
    "target_ticks": 0,
    "target_count": 1,
    "unit": ""
  },
  "given": [
    {
      "ref": "obj.measure",
      "value": 250
    },
    {
      "ref": "obj.unit_ml",
      "value": "mL"
    },
    {
      "ref": "obj.unit_l",
      "value": "L"
    }
  ],
  "target": {
    "ref": "answer.target",
    "type": "selected_unit"
  },
  "method": "unit_selection",
  "plan": [
    "수치 250에 알맞은 단위를 고른다."
  ],
  "steps": [
    {
      "id": "step.1",
      "expr": "250에 알맞은 단위 후보를 비교한다.",
      "value": "mL"
    }
  ],
  "checks": [
    {
      "id": "check.1",
      "expr": "선택한 단위가 문제의 정답 표기와 일치하는지 확인한다.",
      "expected": "mL",
      "actual": "mL",
      "pass": true
    }
  ],
  "answer": {
    "blanks": [],
    "choices": [],
    "answer_key": [],
    "target": {
      "type": "selected_unit",
      "description": "250에 알맞은 단위"
    },
    "value": "mL",
    "unit": ""
  },
  "understanding": {
    "summary": "Find 알맞은 단위 using the given information.",
    "facts": [
      {
        "ref": "obj.measure",
        "label": "measure",
        "value": 250,
        "unit": "",
        "source": "explicit"
      },
      {
        "ref": "obj.unit_ml",
        "label": "unit ml",
        "value": "mL",
        "unit": "",
        "source": "explicit"
      },
      {
        "ref": "obj.unit_l",
        "label": "unit l",
        "value": "L",
        "unit": "",
        "source": "explicit"
      }
    ],
    "unknowns": [
      {
        "ref": "answer.target",
        "label": "알맞은 단위",
        "unit": "",
        "source": "unknown"
      }
    ],
    "relation": {
      "type": "unit_selection",
      "statement": "수치 250에 알맞은 단위를 고른다.",
      "symbolic": "250에 알맞은 단위 후보를 비교한다.",
      "uses": [
        "obj.measure",
        "obj.unit_ml",
        "obj.unit_l"
      ],
      "result": "answer.target"
    },
    "diagnostic_questions": [
      {
        "id": "understand.target",
        "type": "multiple_choice",
        "prompt": "What should we find?",
        "choices": [
          "measure",
          "unit ml",
          "알맞은 단위"
        ],
        "answer_index": 2
      }
    ]
  }
}
