{
  "schema": "modu.solvable.v1.2",
  "problem_id": "S3_초등_3_008540",
  "problem_type": "multiple_choice_multiplication_place_value",
  "inputs": {
    "total_ticks": 1,
    "target_label": "색칠한 부분",
    "target_ticks": 1,
    "target_count": 1,
    "unit": ""
  },
  "given": [
    {
      "ref": "obj.multiple",
      "value": "869 × 4"
    },
    {
      "ref": "obj.highlighted_value",
      "value": "240"
    },
    {
      "ref": "obj.choice_set",
      "value": [
        "6 × 4",
        "69 × 4",
        "60 × 4",
        "600 × 4"
      ]
    }
  ],
  "target": {
    "ref": "answer.target",
    "type": "choice_value"
  },
  "method": "place_value_matching",
  "plan": [
    "色を塗った部分が表す位の値を説明とともに確認します。",
    "選択肢から同じ式を探します。"
  ],
  "steps": [
    {
      "id": "step.1",
      "expr": "869에서 6은 60을 나타낸다",
      "value": "60"
    },
    {
      "id": "step.2",
      "expr": "60 × 4",
      "value": 240
    },
    {
      "id": "step.3",
      "expr": "색칠한 부분 240에 대응하는 보기 찾기",
      "value": "60 × 4"
    }
  ],
  "checks": [
    {
      "id": "check.1",
      "expr": "60 × 4 = 240",
      "expected": 240,
      "actual": 240,
      "pass": true
    }
  ],
  "answer": {
    "blanks": [],
    "choices": [
      {
        "id": "choice.1",
        "label": "(1)",
        "text": "(1) 6 × 4"
      },
      {
        "id": "choice.2",
        "label": "(2)",
        "text": "(2) 69 × 4"
      },
      {
        "id": "choice.3",
        "label": "(3)",
        "text": "(3) 60 × 4"
      },
      {
        "id": "choice.4",
        "label": "(4)",
        "text": "(4) 600 × 4"
      }
    ],
    "answer_key": [
      {
        "id": "choice.3",
        "value": "(3) 60 × 4"
      }
    ],
    "target": {
      "type": "choice_value",
      "description": "색칠한 부분 240에 해당하는 보기 번호"
    },
    "value": "(3) 60 × 4",
    "unit": ""
  },
  "understanding": {
    "summary": "Find which choice represents the highlighted partial product in 869 x 4.",
    "facts": [
      {
        "ref": "obj.multiple",
        "label": "whole multiplication",
        "value": "869 x 4",
        "unit": "",
        "source": "explicit"
      },
      {
        "ref": "obj.highlighted_value",
        "label": "highlighted partial product",
        "value": 240,
        "unit": "",
        "source": "explicit"
      },
      {
        "ref": "obj.choice_set",
        "label": "choices",
        "value": [
          "6 x 4",
          "69 x 4",
          "60 x 4",
          "600 x 4"
        ],
        "unit": "",
        "source": "explicit"
      }
    ],
    "unknowns": [
      {
        "ref": "answer.target",
        "label": "choice matching the highlighted part",
        "unit": ""
      }
    ],
    "relation": {
      "type": "place_value_partial_product",
      "statement": "The digit 6 in 869 has value 60, so the highlighted partial product 240 is 60 x 4.",
      "symbolic": "60 x 4 = 240",
      "uses": [
        "obj.multiple",
        "obj.highlighted_value",
        "obj.choice_set"
      ],
      "result": "answer.target"
    },
    "diagnostic_questions": [
      {
        "id": "understand.place_value",
        "type": "multiple_choice",
        "prompt": "What value does the digit 6 have in 869?",
        "choices": [
          "6",
          "60",
          "600"
        ],
        "answer_index": 1
      },
      {
        "id": "understand.partial_product",
        "type": "multiple_choice",
        "prompt": "Which expression gives the highlighted partial product 240?",
        "choices": [
          "6 x 4",
          "60 x 4",
          "600 x 4"
        ],
        "answer_index": 1
      }
    ]
  }
}
