{
  "schema": "modu.solvable.v1.2",
  "problem_id": "S3_초등_3_008772",
  "problem_type": "comparison_choice",
  "inputs": {
    "total_ticks": 0,
    "target_label": "들이가 더 작은 물병",
    "target_ticks": 0,
    "target_count": 1,
    "unit": ""
  },
  "given": [
    {
      "ref": "obj.bottle.ga",
      "value": {
        "label": "가"
      }
    },
    {
      "ref": "obj.bottle.na",
      "value": {
        "label": "나"
      }
    }
  ],
  "target": {
    "ref": "answer.target",
    "type": "choice"
  },
  "method": "compare_by_transfer",
  "plan": [
    "그림에서 물이 옮겨 담기는 관계를 확인한다.",
    "더 적은 물로도 가득 차는 물병을 고른다."
  ],
  "steps": [
    {
      "id": "step.1",
      "expr": "가 물병의 물이 나 물병에 모두 들어가는 관계를 확인",
      "value": "가 -> 나"
    },
    {
      "id": "step.2",
      "expr": "들이가 더 작은 물병 선택",
      "value": "가 물병"
    }
  ],
  "checks": [
    {
      "id": "check.1",
      "expr": "선택한 물병이 그림의 관계와 일치하는가",
      "expected": "가 물병",
      "actual": "가 물병",
      "pass": true
    }
  ],
  "answer": {
    "blanks": [],
    "choices": [],
    "answer_key": [],
    "target": {
      "type": "choice",
      "description": "들이가 더 작은 물병"
    },
    "value": "가 물병",
    "unit": ""
  },
  "understanding": {
    "summary": "Find 들이가 더 작은 물병 using the given information.",
    "facts": [
      {
        "ref": "obj.bottle.ga",
        "label": "ga",
        "value": {
          "label": "가"
        },
        "unit": "",
        "source": "explicit"
      },
      {
        "ref": "obj.bottle.na",
        "label": "na",
        "value": {
          "label": "나"
        },
        "unit": "",
        "source": "explicit"
      }
    ],
    "unknowns": [
      {
        "ref": "answer.target",
        "label": "들이가 더 작은 물병",
        "unit": "",
        "source": "unknown"
      }
    ],
    "relation": {
      "type": "compare_by_transfer",
      "statement": "그림에서 물이 옮겨 담기는 관계를 확인한다.",
      "symbolic": "가 물병의 물이 나 물병에 모두 들어가는 관계를 확인",
      "uses": [
        "obj.bottle.ga",
        "obj.bottle.na"
      ],
      "result": "answer.target"
    },
    "diagnostic_questions": [
      {
        "id": "understand.target",
        "type": "multiple_choice",
        "prompt": "What should we find?",
        "choices": [
          "ga",
          "na",
          "들이가 더 작은 물병"
        ],
        "answer_index": 2
      }
    ]
  }
}
