{
  "schema": "modu.solvable.v1.2",
  "problem_id": "P3_1_01_00040_15618",
  "problem_type": "multi_numeric_vertical_addition_problem",
  "inputs": {
    "target_label": "두 덧셈의 합",
    "unit": "",
    "expressions": [
      {
        "id": "operation.addition_1",
        "left": 375,
        "operator": "+",
        "right": 413
      },
      {
        "id": "operation.addition_2",
        "left": 607,
        "operator": "+",
        "right": 292
      }
    ]
  },
  "given": [
    {
      "ref": "operation.addition_1",
      "value": {
        "left": 375,
        "operator": "+",
        "right": 413
      }
    },
    {
      "ref": "operation.addition_2",
      "value": {
        "left": 607,
        "operator": "+",
        "right": 292
      }
    }
  ],
  "target": {
    "ref": "answer.all",
    "type": "number_pair"
  },
  "understanding": {
    "summary": "두 세로셈을 각각 계산하여 두 합을 구하는 문제입니다.",
    "facts": [
      {
        "ref": "operation.addition_1",
        "label": "첫 번째 덧셈식",
        "value": "375 + 413",
        "unit": "",
        "source": "explicit"
      },
      {
        "ref": "operation.addition_2",
        "label": "두 번째 덧셈식",
        "value": "607 + 292",
        "unit": "",
        "source": "explicit"
      }
    ],
    "unknowns": [
      {
        "ref": "answer.addition_1",
        "label": "375와 413의 합",
        "unit": "",
        "source": "unknown"
      },
      {
        "ref": "answer.addition_2",
        "label": "607과 292의 합",
        "unit": "",
        "source": "unknown"
      }
    ],
    "relation": {
      "type": "independent_additions",
      "statement": "각 세로셈에서 같은 자리의 수끼리 더하여 두 합을 각각 구합니다.",
      "symbolic": "375 + 413 = first; 607 + 292 = second",
      "uses": [
        "operation.addition_1",
        "operation.addition_2"
      ],
      "result": "answer.all"
    },
    "diagnostic_questions": [
      {
        "id": "understand.target",
        "type": "multiple_choice",
        "prompt": "이 문제에서 구해야 하는 것은 무엇인가요?",
        "choices": [
          "두 덧셈식의 합",
          "두 덧셈식의 차",
          "네 수 중 가장 큰 수"
        ],
        "answer_index": 0
      },
      {
        "id": "understand.alignment",
        "type": "multiple_choice",
        "prompt": "세로셈에서는 어떤 수끼리 더해야 하나요?",
        "choices": [
          "같은 자리의 수끼리 더합니다.",
          "가장 큰 숫자끼리만 더합니다.",
          "위 수에서 아래 수를 뺍니다."
        ],
        "answer_index": 0
      }
    ]
  },
  "method": "각 세로셈에서 같은 자리의 수끼리 더합니다.",
  "plan": [
    "첫 번째 세로셈 375 + 413을 계산합니다.",
    "두 번째 세로셈 607 + 292를 계산합니다.",
    "뺄셈으로 각 합이 맞는지 확인합니다."
  ],
  "steps": [
    {
      "id": "step.add_375_413",
      "goal": "첫 번째 덧셈의 합을 구합니다.",
      "uses": [
        "operation.addition_1"
      ],
      "relation_expr": "첫 번째 합 = 375 + 413",
      "expr": "375 + 413",
      "value": 788,
      "explanation": "일의 자리 5+3=8, 십의 자리 7+1=8, 백의 자리 3+4=7이므로 합은 788입니다."
    },
    {
      "id": "step.add_607_292",
      "goal": "두 번째 덧셈의 합을 구합니다.",
      "uses": [
        "operation.addition_2"
      ],
      "relation_expr": "두 번째 합 = 607 + 292",
      "expr": "607 + 292",
      "value": 899,
      "explanation": "일의 자리 7+2=9, 십의 자리 0+9=9, 백의 자리 6+2=8이므로 합은 899입니다."
    }
  ],
  "checks": [
    {
      "id": "check.addition_1_inverse",
      "expr": "788 - 413",
      "expected": 375,
      "actual": 375,
      "pass": true
    },
    {
      "id": "check.addition_2_inverse",
      "expr": "899 - 292",
      "expected": 607,
      "actual": 607,
      "pass": true
    },
    {
      "id": "check.addition_1_estimate",
      "expr": "round(375, -2) + round(413, -2)",
      "expected": 800,
      "actual": 800,
      "pass": true
    },
    {
      "id": "check.addition_2_estimate",
      "expr": "round(607, -2) + round(292, -2)",
      "expected": 900,
      "actual": 900,
      "pass": true
    }
  ],
  "answer": {
    "type": "multi_numeric",
    "value": [
      788
    ],
    "unit": "",
    "values": [
      788
    ],
    "blanks": [
      {
        "id": "konva_1786192274303_rect_1194250",
        "slot_id": "konva_1786192274303_rect_1194250",
        "expected": 788,
        "unit": ""
      }
    ],
    "answer_key": [
      {
        "slot_id": "konva_1786192274303_rect_1194250",
        "value": 788,
        "unit": ""
      }
    ]
  }
}
